{
  "$schema": "https://json-schema.org/draft/2020-12/schema",
  "$id": "https://legion.dev/schemas/envelope.schema.json",
  "type": "object",
  "required": [
    "event_id",
    "source",
    "source_event_id",
    "topic",
    "dedupe_key",
    "issued_at",
    "payload_summary",
    "trace_id"
  ],
  "properties": {
    "event_id": { "type": "string", "minLength": 1 },
    "source": {
      "type": "string",
      "enum": ["agent", "human", "envoy", "github", "slack", "whatsapp", "ghostwispr", "dispatch"]
    },
    "source_event_id": { "type": "string", "minLength": 1 },
    "source_session": { "type": "string" },
    "topic": { "type": "string", "minLength": 1 },
    "dedupe_key": { "type": "string", "minLength": 1 },
    "issued_at": { "type": "integer" },
    "expires_at": { "type": "integer" },
    "kept_at": { "type": "integer" },
    "payload_summary": { "type": "string", "minLength": 1 },
    "payload_ref": { "type": "string" },
    "payload": { "type": "string" },
    "trace_id": { "type": "string", "minLength": 1 },
    "sender": {
      "type": "object",
      "required": ["session_id"],
      "properties": {
        "session_id": { "type": "string", "minLength": 1 },
        "machine": { "type": "string" },
        "cwd": { "type": "string" },
        "title": { "type": "string" },
        "roles": {
          "type": "array",
          "items": { "type": "string" }
        }
      },
      "additionalProperties": false
    },
    "in_reply_to": { "type": "string", "minLength": 1 },
    "supersedes": { "type": "string", "minLength": 1 },
    "urgency": {
      "type": "string",
      "enum": ["low", "med", "high", "blocking"]
    },
    "expects_reply": {
      "type": "string",
      "enum": ["none", "optional", "required"]
    }
  },
  "additionalProperties": false
}
