{
  "event_id": "dispatch-15",
  "source": "dispatch",
  "source_event_id": "15",
  "topic": "notifications.dispatch.issue.CAPTURE-3.issue.updated",
  "dedupe_key": "dispatch-15",
  "issued_at": 1790124337517,
  "payload_summary": "CAPTURE-3 issue updated",
  "payload": "{\"id\":15,\"issue_key\":\"CAPTURE-3\",\"artifact_id\":null,\"project\":\"CAPTURE\",\"seq\":2,\"type\":\"issue.updated\",\"actor\":{\"kind\":\"user\",\"id\":\"smoke\"},\"notify\":true,\"created_at\":\"2026-09-23T00:45:37.517455Z\",\"payload\":{\"assignee\":\"smoke\",\"closed_at\":null,\"components\":{\"ids\":[],\"inherited_from\":null,\"mode\":\"inherit\",\"reason\":null,\"unknown\":[]},\"created_at\":\"2026-09-23T00:45:31.292611Z\",\"created_by\":{\"id\":\"smoke\",\"kind\":\"user\"},\"external_links\":[],\"key\":\"CAPTURE-3\",\"labels\":[],\"last_seq\":2,\"number\":3,\"parent\":null,\"primary_artifact_id\":\"e7860036-ca1a-4ec6-8bd0-51d5f1b6fbd8\",\"priority\":null,\"project\":\"CAPTURE\",\"rank\":\"UUU\",\"repo\":null,\"resolved_repo\":\"sjawhar/legion\",\"route\":null,\"status\":\"todo\",\"title\":\"Captured workflow issue\",\"updated_at\":\"2026-09-23T00:45:37.517455Z\"}}",
  "trace_id": "dispatch-15"
}
