{
  "event_id": "task315-pr-merged",
  "source": "github",
  "source_event_id": "task315-pr-merged",
  "topic": "notifications.github.sjawhar.legion.pr.42",
  "dedupe_key": "github.task315-pr-merged",
  "issued_at": 1790124795392,
  "payload_summary": "pr merged: sjawhar/legion#42 by merger → merge-c",
  "payload": "{\"action\":\"closed\",\"author\":\"author\",\"base_ref\":\"main\",\"body\":\"Dispatch: LEGION-208\",\"head_ref\":\"legion/LEGION-208\",\"head_sha\":\"head-captured\",\"kind\":\"pr\",\"merge_commit_sha\":\"merge-captured\",\"merged\":\"true\",\"merged_by\":\"merger\",\"number\":\"42\",\"repo\":\"sjawhar/legion\",\"title\":\"Captured GitHub event\",\"updated_at\":\"2026-09-23T00:00:00Z\",\"url\":\"https://github.com/sjawhar/legion/pull/42\"}",
  "trace_id": "task315-pr-merged"
}
